<?xml version="1.0"  encoding="ISO-8859-1"?> 
<!DOCTYPE Configure SYSTEM "configure.dtd"> 

<Configure class="com.mortbay.HTTP.HttpServer">
  <Call name="addListener">
    <Arg>
      <New class="com.mortbay.HTTP.SocketListener">
        <Set name="Port">8081</Set>
        <Set name="MinThreads">5</Set>
        <Set name="MaxThreads">255</Set>
        <Set name="MaxIdleTimeMs">50000</Set>
      </New>
    </Arg>
  </Call>

  <Call name="addContext">
    <Arg>/usr/local/pkgs/java</Arg>
    <Set name="ResourceBase">/usr/local/pkgs/java</Set>
    <Set name="ServingResources">TRUE</Set>
  </Call>
  <Call name="addContext">
    <Arg>/usr/local/pkgs/jdk</Arg>
    <Set name="ResourceBase">/usr/local/pkgs/jdk</Set>
    <Set name="ServingResources">TRUE</Set>
  </Call>
  <Call name="addContext">
    <Arg>/</Arg>
    <Call name="addServlet">
      <Arg>PackageIndex</Arg>
      <Arg>/</Arg>
      <Arg>com.mortbay.Servlets.PackageIndex.PackageIndex</Arg>
      <Call name="setInitParameter">
        <Arg>PackageProperties</Arg>
        <Arg>com.mortbay.Servlets.PackageIndex.PackageIndex</Arg>
      </Call>
    </Call>
    <Call name="addHandler">
      <Arg><New class="com.mortbay.HTTP.Handler.NotFoundHandler"/></Arg>
    </Call>
  </Call>

</Configure>
